title,newspaper,url,published_at,plain_text,keyword,relevance_score,source,mh_matches,covid_matches
Área de aislados por coronavirus : Estamos sin mascarillas y ahí ya nadie limpia,elconfidencial.com,https://www.elconfidencial.com/espana/2020-03-12/limpieza-deficiente-hospital-mascarillas-coronavirus-madrid_2495088/,2020-03-12 19:30:00+00:00,"Área de aislados por coronavirus: ""Estamos sin mascarillas y ahí ya nadie limpia""

Empleados de la contrata de limpieza del Hospital Clínico San Carlos de Madrid denuncian que no pueden hacer su trabajo con garantías para proteger a los pacientes y al personal sanitario

“¡Qué estrés!”. “¡Ayer llegué agotada a casa y hoy tres cuartos de lo mismo!”. Estas son algunas expresiones emitidas por personal sanitario y oídas al vuelo en un largo paseo por las instalaciones del Hospital Universitario Fundación Jiménez Díaz y del Hospital Clínico San Carlos. En estos dos centros médicos, ambos situados al oeste de la capital, ya ha habido muertes por coronavirus.

Sus salas de Urgencias no están abarrotadas, al contrario de lo que cabría esperar ante la emergencia sanitaria provocada por la pandemia del Covid-19, que ya se ha cobrado 84 vidas en España. Dos cosas llaman la atención en la visita: el silencio sepulcral que reina en el ambiente y que todos los pacientes y acompañantes llevan mascarilla.

La tranquilidad interior de esos dos hospitales colindantes contrasta con el ruido de las continuas sirenas del entorno de la plaza de Cristo Rey y con el bullicio que se vive al mediodía del jueves junto a la entrada principal y de Urgencias del Clínico. Allí, megáfono incluido, unos 30 empleados de la contrata de limpieza Garbialdi reclaman a voz en grito mejores condiciones para afrontar la crisis del coronavirus. “¡Parece mentira que no den mascarillas!”, “¡cuatro mopas y dos bayetas no dan para limpiar!”, claman a coro a pleno sol en este veranillo de finales de invierno que vive Madrid.

Los trabajadores se muestran muy inquietos por las condiciones precarias que les facilitan Garbialdi y el propio servicio de hostelería del hospital. A. L. escucha atentamente las proclamas de sus compañeros mientras toma un refrigerio antes de reanudar su labor de limpieza. Está destinada en la cuarta planta, el lugar donde están los pacientes aislados que han dado positivo por coronavirus y que no están ingresados en la unidad de cuidados intensivos. “Es una vergüenza, llevo todo el día en contacto con los positivos y no me dan mascarillas, así que yo ya me niego a entrar a limpiar ahí y nadie más lo va a hacer hoy”, dice esta señora de unos 50 años. Describe estos días como “muy agobiantes” y apunta que no les da tiempo a acometer todas las tareas nuevas que conlleva esta situación excepcional. “Estamos desbordados y el material va escaseando cada vez más”, remata.

En conversación con los empleados de la limpieza concentrados, se quejan de la falta de equipos de protección individual (EPI) cuando están en contacto directo con enfermos de coronavirus. Ya tienen a dos compañeras en cuarentena. Pero también sostienen que la escasez de materiales de limpieza es manifiesta y que esto va en perjuicio claro de los pacientes y del personal sanitario.

En un corrillo alrededor del reportero, varias trabajadoras de la limpieza explican apasionadamente que el número de mopas y bayetas es claramente insuficiente. Con una misma mopa deben limpiar el suelo de una consulta del médico, los pasillos y las habitaciones de los pacientes. En cuanto a las bayetas —argumentan—, llevan una única roja para limpiar los baños generales de los usuarios y de los enfermos, y una sola azul para desinfectar el mobiliario de las habitaciones de los pacientes, de los despachos de los médicos y de las instalaciones generales. Concluyen al unísono que estas circunstancias implican mucho riesgo para todo el personal del Clínico y los pacientes.

Un portavoz del Hospital Clínico San Carlos asegura a El Confidencial que después de haber consultado con el director del servicio de hostelería, “no hay ninguna incidencia por limpieza de las instalaciones y el hospital está en perfecto estado”. Añade que las protestas de los trabajadores de la limpieza se deben a “un asunto interno de la empresa y que este problema es ajeno a la gestión del hospital”.

La empresa vizcaína Garbialdi es la concesionaria de la limpieza del Clínico desde marzo de 2017. Al margen de los problemas actuales por la crisis del coronavirus, su plantilla ya hizo públicas varias quejas por las condiciones deficitarias en las que trabajan. Argumentan falta de personal y escasez de materiales para desarrollar bien su labor. Según comentan a El Confidencial a las puertas del centro hospitalario Elena Varela y Carmen Toribio, miembros de su comité de empresa, Garbialdi ha sido sancionada en meses pasados con 200.000 euros por el Clínico debido a varias irregularidades en el servicio de limpieza. Las condiciones de trabajo no han mejorado ahora que la pandemia se intenta combatir en hospitales públicos como el Clínico.

Un portavoz del hospital confirma a este diario que ha habido “propuestas de sanciones por incumplimientos de contrato”, pero declina ofrecer más información al respecto. Ningún responsable de Garbialdi se puso al teléfono para contrastar los hechos.

Elena Varela, Carmen Toribio y otras dos compañeras fueron sancionadas por la empresa el pasado mes de febrero con 45 días de suspensión de empleo y sueldo por denunciar las condiciones precarias en las que trabajan.

“He sido testigo de cómo los jefes de Garbialdi en el hospital intentan contratar a gente nueva para estos días por el coronavirus, pero dicen que muchos rechazan la oferta por miedo. Tampoco les van a dar buena formación ni material adecuado para su protección, así que no me extraña”, concluye Toribio.

“¡Qué estrés!”. “¡Ayer llegué agotada a casa y hoy tres cuartos de lo mismo!”. Estas son algunas expresiones emitidas por personal sanitario y oídas al vuelo en un largo paseo por las instalaciones del Hospital Universitario Fundación Jiménez Díaz y del Hospital Clínico San Carlos. En estos dos centros médicos, ambos situados al oeste de la capital, ya ha habido muertes por coronavirus.

- El Gobierno activa un primer paquete de 18.000 millones por la crisis del coronavirus Javier G. Jorrín

- Miles de madrileños teletrabajando desde la playa con niños: alerta en las zonas turísticas Víctor Romero. Valencia

- China dice que enviará a España miles de mascarillas y reactivos para el coronavirus C. B.","covid, coronavirus, pandemia",100.0,GDELT,estres;estrés,covid;covid-19;coronavirus;pandemia;cuarentena
Los efectos del aislamiento del Covid - 19 : avalancha de divorcios y baby boom,elconfidencial.com,https://www.elconfidencial.com/tecnologia/ciencia/2020-03-12/cuarentena-china-divorcios-baby-boom_2491964/,2020-03-12 06:00:00+00:00,"Los efectos del aislamiento del Covid-19: avalancha de divorcios y 'baby boom'

La reclusión en sus viviendas de decenas de millones de ciudadanos chinos tiene un relevante impacto psicológico que va desde el aburrimiento hasta la depresión

El pasado 23 de enero, China tomó una decisión tan drástica como inédita: por primera vez en la historia, decidió poner en cuarentena una ciudad de 11 millones de habitantes. Y, en los días siguientes, a Wuhan se le fueron sumando otras localidades de la provincia de Hubei, epicentro de la epidemia del coronavirus. Finalmente, más de 60 millones de personas fueron recluidas en sus casas, y la mayoría aún solo puede salir con una razón justificada. Son ya seis semanas en las que muchos han tenido que combatir sentimientos encontrados: desde el aburrimiento hasta el estrés.

A juzgar por algunos carteles aparecidos en localidades en cuarentena, las autoridades creen que estas pueden ser las condiciones ideales para fomentar un ‘baby boom’: ‘Tener un segundo hijo también ayuda al país’, reza uno de los que más atención han recibido en las redes sociales chinas. Ante el paulatino envejecimiento de la población, el gigante asiático relajó hace un lustro la política de natalidad y, desde entonces, permite que todas las parejas tengan dos descendientes.

Pero la medida ha llegado tarde, porque las nuevas generaciones no parecen interesadas en traer vidas al mundo y China marcó el año pasado un preocupante mínimo en el número de nacimientos: 14,65 millones, 580.000 menos que en 2018.

“La verdad es que pasar tanto tiempo juntos nos ha hecho pensar en la posibilidad de ser padres. El problema es el encarecimiento de la vida y la incertidumbre económica que afrontamos tras la crisis sanitaria”, cuenta por el chat de Weibo —el Twitter chino— un joven de Wuhan que está encerrado con su novia y que se presenta solo como Chen. Habrá que esperar hasta finales de año para comprobar si la cuarentena ha incrementado el ansia de reproducirse, pero lo que ya está claro es que ha aumentado considerablemente las ganas de separarse. Y no solo en la provincia de Hubei.

Como suele suceder por todo el mundo tras el periodo vacacional, muchas parejas han descubierto que no se aguantan y las oficinas del registro civil que han vuelto a abrir sus puertas se han visto desbordadas por las solicitudes de divorcio. Según informó el diario 'Global Times', en la capital de la provincia central de Shaanxi, Xi’an, la avalancha de peticiones ha sido tal que, después de haber alcanzado el tope diario el día 4, en algunos distritos ya no dan cita hasta finales de mes. “Debido a la epidemia, muchas parejas se han visto encerradas durante más de un mes y eso ha facilitado la aparición de conflictos”, explicó un funcionario apellidado Wang.

A la situación extraordinaria que supone la cuarentena hay que sumar en algunas ocasiones el hecho de que se decretó en plena celebración del Año Nuevo Lunar. Eso hizo que algunos quedasen encerrados con familiares que no son bienvenidos.

Es el caso de Yan Li, nombre ficticio de una joven de la provincia de Hubei. “Había acordado con mi marido que pasaríamos el menor tiempo posible con sus padres, pero no pudieron marcharse y acabamos encerrados todos juntos. Aguanté hasta que su madre tiró a la basura el hámster que compré hace un año. Lo justificó diciendo que no era bueno para la salud, que tiene muchas bacterias, y mi marido no hizo nada al respecto. Esa misma noche le pedí el divorcio delante de todos”, contó Yan a la edición china de la revista 'Elle Men'.

Otros simplemente han conocido mejor a la persona con la que se casaron. Como Lin Biao, que vio a su mujer por primera vez en una cita a ciegas. Ambos cedieron a la presión social para casarse, que se agudiza al coquetear con la treintena, y dieron el ‘sí quiero’ cuando apenas habían salido unos meses. China declaró la cuarentena cuando llevaban un año casados. “Nos habíamos visto poco y no hablábamos mucho en casa. Una vida normal, vamos”, cuenta él. La situación cambió radicalmente cuando se vieron enclaustrados en casa y la empresa de ella decidió despedirla.

“Yo sabía que se gastaba todo el dinero del sueldo en compras, pero, ahora que tengo que cuidar yo de toda la familia, ella sigue actuando como si no hubiese sucedido nada y continúa gastando como antes”, critica Lin. Su mujer rechazó trabajar a distancia dando clases y la pareja se ha sumido en una discusión constante de la que no pueden escapar porque apenas salen a la calle. “Le dije a mi mujer que quería el divorcio en medio de la cuarentena y, al cabo de unos días, accedió con la condición de que yo pagase sus deudas. Así puede comenzar una nueva vida”. Ella ya tiene las maletas preparadas.

Otros casos también han acabado viralizándose. Como el de una mujer que, después de tres años casada, descubrió que su marido le estaba siendo infiel. “Era el hombre ideal, pero durante la cuarentena me extrañó que se hiciera selfis todo el rato. En una ocasión, cuando salí para hacer la compra, me olvidé los guantes y volví a casa para recogerlos. Fue entonces cuando lo vi haciendo una videollamada con alguien. Reaccionó abruptamente, dejando el móvil y quitándose los auriculares a toda velocidad. Esa noche hice una cosa que nunca había hecho antes: miré su móvil. Y descubrí la verdad sobre todos sus ‘viajes de negocios’, los hoteles en los que estuvo con esa mujer, y las transferencias que le hacía. Al día siguiente, le dije que lo sabía y decidí que le dejaría en cuanto acabase la cuarentena y encontrase un trabajo”, ha contado ella sin dar su nombre.

La presión a la que la población está sometida durante una cuarentena trasciende las anécdotas puntuales. La prestigiosa revista científica 'The Lancet' incluso ha publicado un informe en el que se detalla cómo la mayoría sufre consecuencias psicológicas adversas, que van desde el estrés postraumático hasta la ira. Entre otras, las causas que las provocan son el propio encierro, el miedo a la infección, la falta de información adecuada o la pérdida de ingresos.

Además, otros especialistas añaden que se pueden sufrir pesadillas, ataques de pánico o depresión. Por eso, recomiendan reducir al mínimo necesario la duración de la cuarentena, explicar bien las razones que llevan a tomar esta medida tan drástica y ofrecer las mejores condiciones posibles durante el encierro.

Eso último es, precisamente, lo que el ‘youtuber’ navarro Javier Telletxea asegura que ha hecho China. “No nos ha faltado de nada durante las seis semanas que llevamos de cuarentena. Hemos podido hacer la compra por WeChat [el WhatsApp chino], y las autoridades incluso han adquirido verduras a los campesinos para regalárnoslas”, explica. Aunque Telletxea reconoce que hay preocupación por la inactividad económica, y que él ha tenido la suerte de residir con su mujer y su suegra en una casa de varios pisos donde puede disfrutar de mayor grado de privacidad, alaba la forma en que el Gobierno chino ha gestionado la guerra contra el coronavirus. Ahora habrá que ver si otros países están a la altura.

El pasado 23 de enero, China tomó una decisión tan drástica como inédita: por primera vez en la historia, decidió poner en cuarentena una ciudad de 11 millones de habitantes. Y, en los días siguientes, a Wuhan se le fueron sumando otras localidades de la provincia de Hubei, epicentro de la epidemia del coronavirus. Finalmente, más de 60 millones de personas fueron recluidas en sus casas, y la mayoría aún solo puede salir con una razón justificada. Son ya seis semanas en las que muchos han tenido que combatir sentimientos encontrados: desde el aburrimiento hasta el estrés.

- El mapa con los eventos cancelados por el coronavirus en España y el resto del mundo Jesús Escudero María Zuil Carlos Muñoz Irene de Pablo

- ¿Qué sabes del Covid-19? Un estudio señala que nunca será suficiente El Confidencial

- No, no necesitas 24 días de aislamiento por el Covid-19: por qué 14 días son suficientes José Pichel","covid, coronavirus, pandemia",100.0,GDELT,depresion;depresión;estres;estrés,covid;covid-19;coronavirus;cuarentena
Cumbre entre CCAA y farmacéuticos : unir protocolos y gestionar ansiedad de clientes,elconfidencial.com,https://www.elconfidencial.com/economia/2020-03-12/farmacias-ccaa-reunion-coronavirus_2494443/,2020-03-12 14:00:00+00:00,"Ante la evolución de la pandemia y la psicosis en los clientes por falta de información.

Cita extraordinaria. Este jueves se reúnen en Madrid representantes de todas las Comunidades Autónomas y responsables del Consejo General de Colegios Oficiales de Farmacéuticos para valorar el impacto que está teniendo la pandemia del Coronavirus en la red asistencial de farmacias, considerado un punto de venta crítico, según fuentes oficiales.

Esta reunión se produce justo un día después de que el Gobierno de Italia ordenara el cierre de todas las actividades económicas y negocios en el país entero, salvo aquellos de primera necesidad, como farmacias y parafarmacias (además de supermercados), dando muestra de la importancia de esta red, que en España atiende a 2,5 millones de clientes al día.

Hasta la fecha, el conjunto de Colegios Oficiales de Farmacéuticos han mantenido comunicación con sus colegiados para remitir información actualizada del Coronavirus en relación con aspectos básicos sobre prevención, tanto para reforzar el conocimiento de los profesionales como para informar a los pacientes de las farmacias, según explica el Consejo.

El colectivo farmacéutico quiere poner en valor su función como referente ante esta situación de emergencia en salud pública, “dada su proximidad a la población, con un papel relevante proporcionando información, consejo y evitando transmitir alarmismos injustificados”, máxime cuando el colectivo de clientes más frecuente es la población mayor.

En la cita de este jueves también se abordarán aspectos de la cadena de suministro, aunque no hay ningún medicamento para el tratamiento del Coronavirus, lo que evita que, al contrario que en el gran distribución, se generen picos de consumo difíciles de atender. Además, la compra de fármacos, aun sin receta, es siempre bajo dispensación de un profesional.

Pese a todo, los farmacéuticos están teniendo que afrontar situaciones vinculadas a la gestión de la ansiedad por parte de algunos clientes, fruto del desconocimiento existente y del temor a que situaciones de vulnerabilidad, según explican fuentes oficiales del sector. Por este motivo, los farmacéuticos consideran que pueden contribuir a gestionar la actual crisis sanitaria.

Cita extraordinaria. Este jueves se reúnen en Madrid representantes de todas las Comunidades Autónomas y responsables del Consejo General de Colegios Oficiales de Farmacéuticos para valorar el impacto que está teniendo la pandemia del Coronavirus en la red asistencial de farmacias, considerado un punto de venta crítico, según fuentes oficiales.","covid, coronavirus, pandemia",60.0,GDELT,ansiedad,coronavirus;pandemia
Igualada : 70 . 000 personas confinadas por el virus y un hospital comprometido,elconfidencial.com,https://www.elconfidencial.com/espana/cataluna/2020-03-12/igualada-70-000-personas-confinadas-hospital_2495764/,2020-03-12 23:45:00+00:00,"Los Mossos han asegurado que todavía hoy por la mañana se permitirá acceder a los camiones de abastecimiento para que las tiendas y centros comerciales tengan surtido para la localidad

La Generalitat cortó por lo sano el brote de Igualada (Barcelona), donde el coronavirus se había descontrolado. Por sorpresa, a las 21:05 anunció que desde las 21:00 ya no podría salir nadie de la ciudad ni de localidades colindantes, como Ódena, Santa Margarida de Montbui i Vilanova del Camí. En total, 70.000 personas atrapadas con un hospital, el de Igualada, donde surgió el brote, y que la 'consellera' de Sanitat, Alba Vergès, ha calificado de “comprometido”. El alcalde de Igualada, Marc Castells, hizo un llamamiento para que dotasen esta instalación de más personal médico, porque el que sigue trabajando y no ha sido infectado está sobrepasado por los acontecimientos.

Hay gente en las calles, pero menos que en otras ocasiones, según explica Esther Dalmases, vecina de la localidad y actualmente confinada en su casa, junto con su marido, maestro de escuela, y sus dos hijos de 20 y 21 años. “En el Passeig, esta tarde ya se veía poca gente”.

Según explica Dalmases, cuyos padres de más de 70 años también viven en la ciudad, “esta tarde empezamos a recibir wasaps de amigos y conocidos que nos mostraban el despliegue de Mossos en los accesos de Igualada, pero pensábamos que se trataba de 'fake news”. “Ahora lo vivimos con mucha ansiedad y muchos nervios”.

En esos vídeos, se ve cómo los agentes, además, despliegan unos plafones que servirán para cortar los accesos. Hasta las 00:00 de este jueves se podía entrar, pero los que lo hagan ya no podrán salir, según ha dictado el Govern de Quim Torra en un Consell Executiu extraordinario celebrado esta tarde en el Palau de la Generalitat. El despliegue policial también es destacable en el aparcamiento del Hospital de Igualada, según han explicado los vecinos. La medida durará 14 días. Los Mossos han establecido controles en todas las vías de entrada y salida de la ciudad.

La Generalitat ha tomado esta dura decisión después de que en un solo día los casos se triplicasen. Pasaron de 20 positivos a 58 en coronavirus. Y había que pararlo. En este momento, hay más de 200 personas confinadas a la espera de ver si desarrollan la enfermedad, según fuentes de la Generalitat.

Los Mossos han asegurado que mañana por la mañana se permitirá acceder a los camiones de abastecimiento para que las tiendas y centros comerciales tengan surtido. Este jueves, ya con el brote descontrolado, las ventas han dejado casi vacío el Mercadona y el Área de Guissona de Igualada, según explica Esther Dalmases. En cambio, en el Caprabo de la localidad todavía había cosas, aunque otras faltaban, según explica Ivan Valls, también vecino de la localidad.

Iván es comercial. Ayer viajó a Berga, Cardona y Manresa, pero es consciente de que “este viernes, si al final la empresa abre, tendré que hacer trabajo de oficina”.

A Iván Valls le llegaron noticias de que podían acabar confinados a media tarde: ""Nos dijeron que podía pasar, que se podía estar decidiendo en la reunión de la Generalitat, y al final así ha sido"".

Los colegios y los centros educativos están cerrados desde ayer, lo que ha hecho que bajase mucho el ritmo de la vida diaria en la ciudad

Ahora, toda su familia se encuentra en casa. Ivan Valls tiene dos hijos de 15 y 18 años. “Están muy concienciados. Este jueves solo hemos salido a comer a casa de mi madre y hemos vuelto muy rápido. Pero ellos no salen”, ha explicado.

Marc Castells ha asegurado a TV3 que “en las últimas 48 horas se han tomado medidas que han afectado mucho a la población. Son momentos difíciles”. Se refería a la suspensión de todos los eventos deportivos para todas las edades y categorías, que ya se decidió anteayer. “El Govern nos ha garantizado que no faltarán ni servicios básicos ni suministros”, ha explicado Castells.

Los trabajadores temporales que tengan que acceder a las zonas vetadas para cumplir con sus obligaciones laborales tienen que entrar y salir enseñando un certificado médico a los cuerpos policiales apostados en las carreteras de entrada y salida.

Se da la circunstancia de que la 'consellera' de Salut es la igualadina Alba Vergès. En la rueda de prensa en que anunció que se aislaba la localidad, se le saltaron las lágrimas e incluso envió recuerdos a sus padres, a su marido y a sus hijos, con lo que apuntaba que ellos se quedaban dentro del cerco y ella fuera para seguir gestionando la crisis de salud pública.

Desde que empezó la crisis del coronavirus en España, este es el confinamiento más grande que se lleva a cabo. “No nos temblará la mano para tomar las medidas necesarias”, aseguró el presidente catalán, Quim Torra, cuando compareció ante los medios. Así ha sido.

La Generalitat cortó por lo sano el brote de Igualada (Barcelona), donde el coronavirus se había descontrolado. Por sorpresa, a las 21:05 anunció que desde las 21:00 ya no podría salir nadie de la ciudad ni de localidades colindantes, como Ódena, Santa Margarida de Montbui i Vilanova del Camí. En total, 70.000 personas atrapadas con un hospital, el de Igualada, donde surgió el brote, y que la 'consellera' de Sanitat, Alba Vergès, ha calificado de “comprometido”. El alcalde de Igualada, Marc Castells, hizo un llamamiento para que dotasen esta instalación de más personal médico, porque el que sigue trabajando y no ha sido infectado está sobrepasado por los acontecimientos.","covid, coronavirus, pandemia",30.0,GDELT,ansiedad,coronavirus;confinamiento
