title,newspaper,url,published_at,plain_text,keyword,relevance_score,source,mh_matches,covid_matches
PNV cree que lo que importa es afrontar la crisis y aplazar o no el 5 - A es ya  cuestión de segundo orden  ,20minutos.es,https://www.20minutos.es/noticia/4187580/0/pnv-cree-que-lo-que-importa-es-afrontar-la-crisis-y-aplazar-o-no-el-5-a-es-ya-cuestion-de-segundo-orden/,2020-03-14 09:15:00+00:00,"En un artículo publicado en su blog, recogido por Europa Press, el dirigente jeltzale se ha referido a la crisis sanitaria generada por el Covid-19 y su influencia en las elecciones autonómicas convocadas para el 5 de abril.

Tras reconocer que hoy ""el país no está para hablar de elecciones ni para alimentar una confrontación ideológica que desemboque en las urnas"", Mediavilla considera que ""lo importante es lo que nos debe centrar a todos: la seguridad y la salud de las personas"".

Para el representante del PNV, la crisis sanitaria provocada por el coronavirus ha generado una situación inédita en Euskadi de tal forma que la pandemia se ha extendido ""sin posibilidad de evitar su paso"".

""Sin vacuna y en un mundo globalizado en el que personas y mercancías circulan libremente por todo el planeta, la propagación de una enfermedad contagiosa como la del Covid-19 nos ha vuelto a situar en un desafío insospechado"", valora, al tiempo que recuerda que las consecuencias económicas ""se dejarán notar en todas las sociedades desarrolladas a modo de caída del empleo y recesión productiva"".

Por otro lado, subraya que Euskadi dispone de un servicio público de salud ""de reconocido prestigio y solvencia"", aunque advierte de que, ""si el período cumbre de contagio se concentrase en unas pocas fechas, el número de pacientes a ser atendidos en hospitales sería disparatado y no habría solución mágica que dispusiera de recursos humanos y materiales suficientes para hacer frente a una situación descontrolada"".

""De ahí las medidas de contención reforzada recomendadas por las autoridades sanitarias. Normas incómodas, gravosas, que interrumpen el ritmo cotidiano de las personas. Pero, al mismo tiempo, acciones indispensables para hacer frente a lo que se nos viene encima"", añade.

A su juicio, ""lo peor no ha pasado aún, y previsiblemente, la población vasca deberá asumir pruebas de estrés social aún más duras"", cuestión que ""nadie lo ha ocultado"". ""Lo único que importa en estos días es esto, afrontar eficazmente esta prueba. Y en su acertada gestión todos deberemos apoyar a las autoridades que hacen frente a la alarma que nos aflige"", defiende.

Por todo ello, considera que superarla dependerá de una gestión rigurosa pero, fundamentalmente, del comportamiento individual e intransferible de cada persona ante la responsabilidad que debe acometer en esta situación ya que ""cada ciudadano, cada persona, es una vacuna en potencia y de nuestro comportamiento depende la evolución de un panorama cuyas consecuencias no alcanzamos aún a conocer"".

""Que las elecciones autonómicas, previstas para el 5 de abril, se celebren o, si se encuentra vía legal, se aplacen, es cuestión de segundo orden. Importante, sí, pero de un nivel de relevancia de distinto plano. Estoy convencido de que el lehendakari Urkullu, tras escuchar a las formaciones políticas el próximo lunes, sabrá determinar cuál es la mejor decisión para todos"", concluye.","covid, coronavirus, pandemia",60.0,GDELT,estres;estrés,covid;covid-19;coronavirus;pandemia
Sandra Marín ( coach ):  El coronavirus puede ser una oportunidad para construir niños más seguros  ,20minutos.es,https://www.20minutos.es/noticia/4187517/0/sandra-marin-coach-el-coronavirus-puede-ser-una-oportunidad-para-construir-ninos-mas-seguros/,2020-03-14 08:30:00+00:00,"Sandra Marín (coach): ""El coronavirus puede ser una oportunidad para construir niños más seguros""

Basado en hechos observados y verificados directamente por nuestros periodistas o por fuentes informadas.

- La experta recomienda intentar ver el aislamiento como una experiencia positiva en vez de como un castigo.

- Hacer uso de la tecnología para calmar la ansiedad de no estar con los abuelos y para que vean que están bien.

Muchos días por delante sin el jaleo, las risas y el calor de los compañeros de clase, mamá y papá intentando teletrabajar en el salón mientras les ayudan con las tareas del colegio, confinamiento casero para frenar al virus, clausura de parques, ‘cese temporal’ de reuniones y relaciones con los abuelos para evitar contagios... Más de ocho millones de niños y adolescentes españoles se enfrenten estos días a cambios drásticos y muy duros en sus rutinas, formas de estudio y relaciones sociales y familiares. La experta en comunicación y coach Sandra Marín - especializada en la formación y orientación de personas y empresas- despeja dudas en esta entrevista sobre cómo abordar con los más pequeños de la casa la crisis originada por el coronavirus.

¿Cómo debemos explicarles qué es el Covid-19?

Hay que intentar ser transparentes. Primero preguntarles qué es lo que saben acerca de la enfermedad para saber cómo lo están gestionando y una vez tengamos estos datos aclararles las dudas que tengan, los miedos, las inseguridades. Los niños son muy fantasiosos y si escuchan la radio, o ven la tele o navegan por internet pueden ver cosas que les afecten e, incluso, malinterpreten. También les va a ayudar mucho crear momentos en familia para hablarlo con naturalidad pero sin que sea un monotema. Esto les va a facilitar poder expresarse, confiar en nosotros y, a la vez, transmitirles seguridad.

Hay que indicarles que tenemos que cuidarnos y protegernos de este virus y explicarles los síntomas para que sepan reconocerlos. A partir de ahí, yo les pondría una especie de reto o juego para establecer de manera divertida cómo tenemos que toser, que no debemos tocarnos la cara... Algo que sea divertido y no una imposición. Quizá también jugar con algún tipo de poder sobrenatural, hacerles pensar que ellos tienen el poder de protegernos de algo. Pero, sobre todo, no poner un tabú en esto.

Como padres también tenemos que mostrar una coherencia: tenemos que vigilar nuestras conversaciones entre adultos, que nos vean tranquilos, seguros y sobre todo no alarmarlos con actitudes. Por ejemplo, si vemos que toca algo y luego se lleva las manos a la boca más de uno va a saltar de miedo, pues esto hay que controlarlo.

Si no se puede ir al colegio como ocurre ahora hay intentar mantener horarios y hábitos habituales. A modo de juego podemos preguntarles ‘¿ahora qué harías en el colegio?’ y realizar algunas actividades. Encontrar también espacios para el juego, darles alguna responsabilidad según la edad que tengan asignándoles algunas tareas... Todo con mucha naturalidad, intentando mantener una cierta estabilidad dentro de que es un cambio importante de hábitos para ellos. Aprovechar estos espacios para compartir más tiempo, para fomentar la creatividad, el estado de juego, la familia... Hay que pensar que si lo hacemos bien van a crear unos hábitos que le van a servir para toda la vida. Hay que verlo como una oportunidad para enfocarlo como algo positivo para ellos a largo plazo.

Si sienten curiosidad o les asusta saber que está muriendo gente a causa del coronavirus, ¿cómo podemos abordar este hecho concreto?

También con mucha naturalidad y transparencia. Explicándoles que como en cualquier otra enfermedad algunas personas mueren pero que es algo menor, que el porcentaje es bajo. Hay que relativizar las cosas pero tampoco negárselas porque ellos van a encontrar información, tienen muchas maneras de corroborarlo, por eso hay que parecer y ser honestos. En cualquier caso, el foco no tiene que estar puesto ahí, hay que contestarles pero también redirigir la atención hacia algo más constructivo como, por ejemplo, qué tenemos que hacer para estar bien, para estar sanos, para contribuir a protegernos entre todos y darles herramientas para que tengan la mente ocupada.

Muchos niños habrán oido estos días que pueden ser potenciales transmisores de la enfermedad a sus abuelos. ¿Cómo podemos gestionar esos sentimientos de culpabilidad, de miedo a hacerles daño o tristeza por no poder verles durante unos días?

Hay que insistir en contar las cosas como son. Que esta situación conlleva un periodo donde no vamos a poder darles abrazos y besos pero eso no impide que no nos podamos ver. Tenemos que hacer un buen uso de las tecnologías para calmar esa ansiedad y en compenetración con los abuelos naturalizar esto. No hay culpa ni responsabilidad, es un virus que está en el aire, nadie es responsable de ello. No hay que dejar de lado que tenemos que intentar mantener una normalidad donde los abuelos puedan seguir viéndolos aunque sea por un FaceTime, un WhatsApp, una videollamada... Que ellos puedan ver que sus abuelos están bien, que están sanos y no se les está ocultando nada, poniendo el foco en que esto será cuestión de pocos días y todo volverá a la normalidad.

Habrá momentos en casa en que surjan picos de estrés y ansiedad. ¿Cuáles son las claves para mantener la calma?

Es muy humano y muy natural. La calma in eternum no existe porque somos seres emocionales por eso hay que dar espacio a que esas cosas también sucedan. Lo más importante es vivirlas bien. Cada uno tiene necesidad de tener su propio espacio y de repente tener que convivir todos juntos 24 horas durante x días se hace cuesta arriba. Es como si fueran vacaciones pero forzadas y además con obligaciones porque muchos tendrán teletrabajo. Hay que intentar conciliar esa parte de intimidad profesional con la vida personal porque los niños muchas veces no entienden ni de déjame ni de espacios. Más que intentar respirar, lo que funciona es entender que hay cosas que no vas a poder controlar porque cuando saltamos nuestro cerebro más racional es secuestrado por el emocional. Hay que intentar racionalizar y pensar ‘esto es normal y necesito de espacio o calma’. Tener claro que estos episodios se van a repetir en estos días y que tenemos que ver cómo anticiparnos a ellos: salir un momento al balcón, cambiar de tarea, cambiar de habitación... Si ya ha saltado, entender que es normal porque son muchas horas en un espacio reducido. Y sobre todo, vivir el momento presente, disfrutar de la oportunidad de tener que estar juntos y vivir esto como una experiencia positiva en vez de como un castigo o una obligación.

¿Cuál debe ser la actitud de los padres estos días? ¿Conviene estar hablando del tema todo el rato o viendo las noticias de la tele delante de los niños?

La sobreinformación conduce a una saturación y a un monotema tanto en tu cabeza como en tus conversaciones. Hay que elegir muy bien el medio o los medios oficiales en los que queremos estar informados, no caer en el alarmismo ni el consumismo de noticias sin ton ni son y ponerle un límite. Tenemos que saber vivir con eso y gestionar bien lo que ya sabemos porque nuestro estado anímico influye mucho en nuestro día a día, en nuestra productividad y la familia.

En el caso de tener un hijo adolescente. ¿Cómo podemos gestionar sus ganas de salir de casa?

Hay que intentar negociar y encontrar espacios para todo porque mantener a un adolescente encerrado en una casa 15 días a cal y canto es muy complejo. Se tiene que negociar, una cosa que no va a poder ser es irse a una discoteca o a una reunión en casa de alguien pero sí se puede encontrar algún momento para compartir en un espacio abierto, donde no haya tanto contacto ni quedes con tanta gente. Hay que negociar y negociar bien, ser empáticos pero insistirle en que hay ciertos límites que no podemos cruzar. Sino la negociación se convertirá en una imposición por parte de ellos. Hay que hacerles entender que es una situación atípica, excepcional, de corta duración y que hay que buscar otros medios de comunicarse y de ocio. Insistirles en que busquen esa parte más creativa y en que hay que atender a las fuentes oficiales sobre lo que se puede y no se puede hacer.

¿Esta situación puede dejarles secuelas a los niños o es una oportunidad para hacerles más fuertes ante otra situación límite que puedan vivir en el futuro?

Al final, como lo viva yo es como lo van a vivir mis niños. Como lo transmita yo es como ellos lo van a percibir. Por tanto esto puede ser una oportunidad para que les deje marcados o bien para construir personas más seguras, más fuertes, más creativas, que busquen siempre la parte positiva, instalarles nuevos hábitos… Esa es una combinación super potente para cualquier tipo de adversidad que puedan tener, tanto profesional como personal y, es más, podemos recurrir siempre a esta experiencia y buscar esas herramientas que estamos utilizando en este momento para salir adelante para vencer una adversidad que tengamos en el futuro. Que quede como un anclaje, que le haga rememorar toda aquella fuerza y los recursos que utilizó para salir adelante.","covid, coronavirus, pandemia",100.0,GDELT,ansiedad;estres;estrés,covid;covid-19;coronavirus;confinamiento
UGT pide que se limite el aforo en los supermercados y grandes superficies,20minutos.es,https://www.20minutos.es/noticia/4187813/0/ugt-pide-que-se-limite-el-aforo-en-los-supermercados-y-grandes-superficies/,2020-03-14 14:30:00+00:00,"La organziación sindical ha indicado que las medidas que se están adoptando en tantos ámbitos para la contención del virus no pueden tener limbos para su aplicación en según qué lugares y colectivos, siempre adaptándolas a la necesidad de conciliar el interés de clientes, trabajadores y salud pública.

Por tanto, para UGT, el hecho de que supermercados y grandes almacenes permanezcan abiertos para atender las necesidades básicas de la ciudadanía no puede suponer que el ""acceso sea masivo, irracional o compulsivo en función de distintos factores que alimentan el alarmismo en la sociedad"".

En este sentido destacan que los supermercados también son un espacio donde el coronavirus puede contagiarse si no se cumplen las medidas de distanciamiento social recomendadas por la Administración pública y las autoridades sanitarias.

Por ello desde UGT piden que se lleven a cabo, lo antes posible, algunas acciones como la limitación de aforo en supermercados y grandes superficies aplicando el criterio de dos metros de diámetro de distancia entre personas.

Además solicitan que se dote de personal de seguridad o servicios auxiliares sufciente a cada uno de los centros para el control de acceso en cumplimiento de la limitación de aforo y que el Ministerio del Interior y las delegaciones del Gobierno, a través de las Fuerzas y Cuerpos de la Seguridad del Estado, doten a aquellos supermercados que lo necesiten de recursos para garantizar la seguridad y la normalidad en los accesos a estos centros.

También reclama UGT dotar de medidas de autoprotección contra el virus (mascarillas, guantes y solución hidroalcohólica) a todos los trabajadores y trabajadoras, cuya exposición es constante a lo largo de toda la jornada de trabajo.

Otra de las medidas propuestas es que la Administración pública y las propias empresas de distribución alimentaria difundan mensajes institucionales apelando a un consumo responsable por el bien de todos y todas los ciudadanos, y a una actitud serena y constructiva con los profesionales de los supermercados que, como se puede intuir, están en unas condiciones de estrés considerables.","covid, coronavirus, pandemia",10.0,GDELT,estres;estrés,coronavirus
"Crónica del Covid - 19 , por Sandra Barneda",lavanguardia.com,https://www.lavanguardia.com/opinion/20200314/474114653214/cronica-del-covid-19.html,2020-03-14 03:45:00+00:00,"La crónica, ese género híbrido entre literario y periodístico que narra los hechos al mismo tiempo que los interpreta, ha vuelto a nuestras vidas. Son ya muy pocos, dado el estado de excepcionalidad en nuestro país como medida preventiva frente al Covid-19, los que no reciben un vídeo de un médico, un audio de algún familiar, decenas de capturas sobre comentarios en redes sociales, o devoran con ansia los periódicos y digitales.

Los antiguos, frente a situaciones como la nuestra, acudían a las plazas para leer los carteles colgados o a voces en los conocidos como mentideros de la corte. Por entonces, dada la baja alfabetización de la población, tenían pocos recursos para informarse, nosotros, consagrada la sociedad global, tenemos acceso a tal cantidad de información que se convierte en el mayor distorsionador de la realidad. El pánico en una semana se ha contagiado más que el propio coronavirus y, a diario, vivimos situaciones dantescas, como el asalto desmedido en los supermercados, que nos acercan más al sálvese quien pueda que a la solidaridad.

En Madrid, hasta el momento el principal foco de contagio en España, las calles son desierto, los bares y restaurantes hablan de otra época, y los pequeños negocios rezan para que el virus no se lleve por delante su economía primero. El goteo de noticias es constante, incluso puede que ya esta crónica quede antigua al leerla, pues corren rumores de que le queda poco a la capital para quedar bloqueada. Los vídeos, los audios de nuestros cronistas nos cuentan las novedades y aumentan nuestro estrés por la gran incertidumbre que se ha generado en torno a la ya declarada por la OMS pandemia global.

Todos reaccionamos a ello y puede que en estos primeros días, sin mirar demasiado por el otro ni observar que esta crisis ofrece un receso a los ritmos acelerados, un cambio en las prioridades puede devolvernos aquello de humano que hemos perdido. Puede que, cuando todo pase, abracemos de otra forma, nos toquemos con la conciencia de lo que tuvimos en juego, incluso sabremos mucho más de los nuestros de lo que sabemos ahora.

La comunicación no deja de fluir a pesar de las recomendaciones de permanecer aislados. Es la ventaja de nuestro mundo global, pero al mismo tiempo riesgosa porque Madrid se ha deformado con nuestra mirada cóncava y de ombligo. La prudencia también se medirá en nuestras crónicas, nuestros envíos, nuestro afán de adquirir por una necesidad llamada pánico insolidario.","covid, coronavirus, pandemia",70.0,GDELT,estres;estrés,covid;covid-19;coronavirus;pandemia
Madrid se enclaustra,lavanguardia.com,https://www.lavanguardia.com/vida/20200314/474114654729/coronavirus-madrid-confinamiento.html,2020-03-14 03:45:00+00:00,"Apenas se ha superado el tercer día del confinamiento domiciliario en Madrid, pero parece que han pasado 10 días. Los estados de ánimo cambian por horas, así que dependiendo del momento y el lugar de la capital en el que uno se encuentre, el nerviosismo es calma tensa, crispación o histeria. Lo que ha quedado claro es que los madrileños, al menos los que se han quedado en la capital y no han incumplido las recomendaciones sanitarias convirtiendo la cuarentena en una suerte de quincena vacacional en la costa valenciana, se han tomado la cosa en serio. A falta de vacuna, la responsabilidad individual se ha convertido en uno de los principales antídotos. Y los madrileños se han puesto a la tarea.

Tras un descenso progresivo desde el lunes en el número de usuarios de autobuses y metro, el bajón de ayer fue radical y el suburbano apenas transportó al 45% de los viajeros que acostumbran a abarrotar los convoyes entre semana. El plano general de la Gran Vía completamente vacía que inmortalizó Alejandro Amenábar en su película Abre los ojos es una realidad y el número de kilómetros de atasco registrado ayer en la M-30 fue cero.

Por no hablar de las terrazas. Pese a que los bares apuraron hasta última hora antes de acatar la nueva prohibición de abrir sus puertas, las mesas y sillas lucían vacías. Salvo media docena de turistas en la plaza Mayor y otra decena de personas en la plaza de Santa Ana, la imagen era muy diferente de la registrada la víspera en la que, al calor de los 16 grados que marcaban los termómetros, los camareros no daban abasto incrédulos por la desobediencia a la recomendación de mantener la distancia de un metro entre comensales.

Ayer, sin embargo, las pocas conversaciones de barra se centraron en la desazón ante los previsibles efectos económicos que se le avecina al sector de la hostelería que engloba a más de 31.000 establecimientos en la región.

Tampoco es ya necesaria la prohibición de cerrar los parques infantiles que tantos retuits coleccionaba en las redes sociales. Tanto los abuelos como los padres y madres que han hecho malabarismos para cuadrar su jornada laboral con el cierre de colegios, buscaron refugio en casa. Columpios desiertos a la espera de que el temporal amaine.

Ni siquiera el Autocine Madrid Race, que hasta el jueves mantuvo sus sesiones para las familias y grupos que optaban por disfrutar del séptimo arte desde sus coches para evitar contagios, se ha librado de la bajada de persiana generalizada.

Las restricciones han llegado hasta a las comunidades de vecinos en forma de circular conminando, entre otros, a mantener las distancias hasta para hacer uso del ascensor.

La imagen contrasta con la que se vive en el entorno de los centros hospitalarios, colapsados desde hace días tras superarse la barrera de los 2.000 casos de coronavirus diagnosticados. No hay salas de espera suficientes para todos los pacientes potenciales que solicitan someterse a la prueba tras presentar los síntomas del Covid-19. El director del Centro de Coordinación de Alertas y Emergencias Sanitarias, Fernando Simón, reconoce que hay hospitales en Madrid “muy saturados” en los que se está trabajando “bajo un estrés muy importante”. Y, aunque ha precisado que la carga asistencial es “muy desigual” entre centros sanitarios, se advierte de que Madrid corre el riesgo de quedarse sin camas de UVI en los hospitales.

¿En qué momento cambió todo? Más allá de que buena parte de la población no comprendiera la gravedad de la situación hasta que la Liga de fútbol suspendió las dos próximas jornadas, el verdadero toque a rebato se declaró en dos tiempos.

El primero, al filo de las 13.30 horas. Cuando la Comunidad de Madrid decretaba el inminente cierre de todos los establecimientos salvo negocios de alimentación (tiendas y mercados), farmacias y quioscos con el objetivo de frenar los contagios por coronavirus. El segundo, pasadas las 15.30 horas. Con la solemne declaración del estado de alarma por parte del presidente del Gobierno, Pedro Sánchez.

En las tres horas siguientes estancos, clínicas veterinarias, supermercados, fruterías y farmacias pasaron a registrar colas por la ansiedad por contar con el aprovisionamiento necesario para bunkerizar los domicilios particulares durante las próximas semanas.

La imagen se había producido parcialmente en los días previos, pero el rictus de muchos de los clientes era otro. Ahora apenas hay espacio para el chascarrillo o la broma. Madrid ya no lleva vida normal a la espera de recuperar su vigor en unas semanas. Cuando el coronavirus sea vencido.

Comparte tus fotos, tus vídeos o tus escritos explicándonos y mostrándonos cómo pasas el tiempo del confinamiento en casa y cómo vives las medidas del estado de alarma. Ayúdanos a crear un gran muro con testimonios gráficos y vivenciales de este acontecimiento histórico. Envía tus documentos, con tus datos personales, a nuestro correo participacion@lavanguardia.es.","covid, coronavirus, pandemia",30.0,GDELT,ansiedad;estres;estrés,covid;covid-19;coronavirus;confinamiento;cuarentena;estado de alarma
