title,newspaper,url,published_at,plain_text,keyword,relevance_score,source,mh_matches,covid_matches
"Entre el temor y la calma en Txagorritxu , contagiado por la cuarentena informativa",elconfidencial.com,https://www.elconfidencial.com/espana/pais-vasco/2020-03-11/hospital-txagorritxu-vitoria-principal-foco-coronavirus-euskadi-sanitarios-apagon-informativo_2490488/,2020-03-11 06:30:00+00:00,"Los mensajes de que se trabaja con ""relativa normalidad"" contrastan con el diagnóstico de un hospital ""fantasma desbordado"", mientras Sanidad niega ahora los datos de sanitarios afectados

“De momento, sobrevivimos”. Una sanitaria del hospital de Txagorritxu de Vitoria recurre al humor para combatir al coronavirus con las palabras. La cosa –reconoce– no está para muchas bromas a nivel interno, con el centro de referencia para atender la epidemia convertido en un punto crítico a raíz del contagio de varios profesionales médicos, pero utiliza este tono para proyectar un mensaje de tranquilidad “entre tanta histeria”, sobre todo externa. Su equipo ya ha planificado una excursión a una bodega cuando todo se tranquilice. Pero esta escapada, se tiene asumido, tardará un tiempo en llegar.

“Nos esperan una semanas duras de mucho trabajo porque ahora estamos en el punto alto de incubación del virus”, afirma. De momento, su jornada laboral no se ha ensanchado pese al aumento de las tareas, pero es consciente de que es cuestión de tiempo de que la carga de trabajo prolongue el horario. “Es una situación excepcional y como tal hay que tratarla”, asevera. Admite que “se ha podido responder tarde” a la crisis, pero defiende que se han adoptado las “medidas pertinentes más o menos razonablemente” para tratar de contener el virus en el complejo sanitario. Por ello, se muestra muy crítica con “la alarma que se está generando” en torno a la situación en la que se encuentra el hospital. Tanto desde dentro como desde fuera. “Es cierto que hay inconvenientes derivados de los protocolos de seguridad, como el tiempo que tardamos en ponernos el traje especial, pero estamos trabajando con relativa normalidad”, replica.

Pero hay voces internas que no comparten este diagnóstico y hablan de un hospital “fantasma” con servicios “desbordados” por el exponencial incremento de hospitalizados por coronavirus, lo que ha obligado a habilitar nuevas zonas hospitalarias como espacios de aislamiento de pacientes infectados por el Covid-19. “La situación es muy complicada. Se podría decir que crítica”, confronta otra profesional, que pone de relieve que la situación está provocando “mucho estrés” en una plantilla ya de por sí mermada por el aislamiento domiciliario al que se está sometiendo durante 14 días a numerosos profesionales a raíz de los positivos registrados entre el personal sanitario.

Más allá de las fotografías particulares, la realidad refleja que se han cancelado citas médicas, suspendido intervenciones quirúrgicas, reorganizado servicios sanitarios, derivado profesionales a este complejo sanitario o asignadas otras tareas a médicos. El movimiento en Txagorritxu se ha reducido tras la limitación de las visitas o la prohibición a los pacientes de salir de sus habitaciones, con las consultas médicas funcionando a un menor ritmo ante las medidas adoptadas encaminadas a evitar concentraciones en estas zonas, caso de espaciar las citas en el tiempo. “Todo ha ido normal”, señala una joven que ha acudido a consulta con su madre para un seguimiento de su patología.

Se están propagando por Whatsapp audios que describen una situación apocalíptica en Txagorritxu: Sanidad trata de identificar a los protagonistas

Las Urgencias mantienen una gran actividad y no faltan las personas que acuden al presentar posibles síntomas de coronavirus, haciendo caso omiso a los llamamientos sanitarios a los ciudadanos a no acudir de forma presencial al hospital y llamar por teléfono para que, en su caso, sean atendidos por las unidades de diagnóstico domiciliario. Pero hay alarma entre la población ante la expansión del coronavirus. Y el notable incremento de hospitalizados en los últimos días preocupa, y mucho, entre el personal sanitario de Txagorritxu. De las 72 personas con coronavirus ingresadas en el País Vasco –el 36% de los positivos en Euskadi está hospitalizado–, 51 los están en Vitoria. Esto supone que uno de cada tres positivos en Álava está en estos momentos en tratamiento en complejos sanitarios. En Vizcaya, la cifra de hospitalizados se sitúa en 18 y en Guipúzcoa se limita a tres.

La ""realidad es la que es"" y, en este escenario, los mensajes a la calma y a la tranquilidad se mezclan con la sensación de temor, preocupación e incertidumbre. Los estados son muy diversos, ya sea puertas para adentro en Txagorritxu como hacia fuera. “Cada uno expresa sus sentimientos de manera diferente”, se comparte. Por Whatsapp se está propagando a gran velocidad por Vitoria diferentes audios de supuestos profesionales sanitarios que describen una situación alarmante, caótica, casi apocalíptica, en Txagorritxu. No hay profesional en este complejo que no haya recibido estos testimonios sonoros a través de diferentes grupos. De hecho, las autoridades sanitarias vascas están tratando de identificar a sus protagonistas, según apuntan testimonios internos.

El Gobierno vasco se niega ahora a dar datos de sanitarios afectados: alude a la protección de datos y a ""la estigmatización de centros y profesionales""

Se quiere imponer la cuarentena informativa en torno a Txagorritxu. De hecho, la propia consejera de Sanidad, Nekane Murga, ha dado un giro en la política de comunicación seguida en los primeros días de la crisis al decretar ahora un apagón informativo en relación a los profesionales sanitarios infectados o en aislamiento domiciliario. La última vez que se pronunció al respecto fue a mediados de la pasada semana, cuando dio cuenta de cinco sanitarios contagiados y más de un centenar de profesionales en cuarentena. Desde entonces, se niega a ofrecer datos al respecto en sus comparecencias diarias, al tiempo que los positivos se incrementan de forma notable, convirtiendo a Euskadi en la segunda comunidad más afectada tras Madrid.

“Nos pareció relevante en ese momento”, aludió en su intervención de este lunes para defender el silencio autoimpuesto en estos momentos, y que también enmarcó en la protección de datos, algo a lo que, sin embargo, no aludió en sus primeras intervenciones al estallar la crisis cuando ofreció cifras al detalle. Este martes, además, la consejera de Sanidad ha ido un paso más allá al justificar este mutismo para “intentar salvaguardar la estigmatización de centros” y de los profesionales, a la vista de “informaciones que se han hecho” sobre sanitarios y el hospital de Txagorritxu que “no han sido correctas”.

En la diana de Sanidad están los sindicatos, que han denunciado la demora a la hora de responder a la expansión del coronavirus entre el personal sanitario. Así, entre las críticas, las centrales censuran la tardanza en practicar la prueba del Covid 19 a la doctora considerada ‘paciente cero’ de este foco, y que motivó la expansión inicial de la patología entre compañeros sanitarios. También CCOO ha alertado de que una trabajadora de Txagorritxu de 50 años se encuentra grave por no ser diagnosticada a tiempo con la enfermedad.

Los reproches del Departamento de Sanidad se proyectan también sobre el tratamiento periodístico que se le da a ciertas informaciones al dar pábulo a estas denuncias. “Estoy asustado de que se haya dado esta información [la de la trabajadora que se encuentra supuestamente grave tras la denuncia de CCOO] Una de las cosas a preservar en el sistema sanitario y la sociedad en general es la confidencialidad de los datos. Me preocupa que se den este tipo de informaciones. Les pediría, en este sentido, evitar en todo momento dar datos no solo de nombres y apellidos sino de profesionales que pudieran orientar a la identificación de una persona. Es algo importante”, ha aseverado el director de Salud, Iñaki Berroeta. También se ha dirigido a los sanitarios afectados de algún modo por la epidemia para decirles que “tienen sus foros para las reclamaciones de este tipo” en vez de acudir a los medios de comunicación.

Salud dice a los sanitarios afectados de algún modo por la epidemia que ""tienen sus foros"" para las reclamaciones en vez de denunciar ante los medios

“La respuesta no la puedo dar en estos momentos. Creo que no corresponde darla”, ha replicado Murga este martes al ser interpelada por el número de sanitarios que engrosan la lista de 197 positivos confirmados en el País Vasco tras registrarse 49 casos en las últimas 24 horas –Álava concentra más del 80% de los contagios en Euskadi–. No dar estos datos no significa, según ha defendido, que se esté “ocultando” información. “Damos la información que creemos conveniente y pertinente dar. No ocultamos información. Es información cambiante y puede suponer en ocasiones estigmatizar centros, como está ocurriendo, porque se han hecho informaciones sobre profesionales que en algunas ocasiones no han sido correctas”, asevera.

La consejera se escuda en que no todos los positivos de sanitarios en Txagorritxu obedecen al contagio de profesionales de este recinto sanitario. “Se están estudiando las líneas de contagio y la agrupación y, en ocasiones, el contagio de estos profesionales había sido externo al medio hospitalario”, señala. “Ahora que conocemos mejor cómo han sido las cadenas de transmisión creemos que aquello que pueda permitir identificar a profesionales es algo que no se debe hacer de forma pública. Por eso es el motivo [de no ofrecer datos que aluden a los profesionales sanitarios]”, subraya.

Los reproches también aluden a las informaciones que dan cuenta del cierre de determinadas residencias sociosanitarias. “No me gusta dar datos que permitan localizar e identificar profesiones, personas, clínicas o profesionales”, remarca. En todo caso, la consejera ha aportado información concreta en anteriores comparecencias de algún caso registrado en Vitoria, que es uno de los principales focos de la epidemia en España, lo que ha obligado a decretar el cierre desde este mismo martes por espacio de 14 días de todos los centros educativos, ya sean guarderías, institutos o el campus universitario de la UPV-EHU, para prevenir la expansión del virus. Con este objetivo también se ha acordado paralizar la actividad en un colegio de Laguardia y los dos centros de Labastida, localidades que guardan una “proximidad” e “interrelación” con el foco de coronavirus de Haro, el municipio riojano situado a escasos kilómetros que concentra el mayor número de casos por número de habitantes en España.

Pese a ser escenarios de “contención reforzada”, el Gobierno vasco descarta limitar la movilidad en estas poblaciones. “No podemos ni debemos avanzar medidas que no son de este momento, en la fase de contención y de evitar la transmisión en áreas concretas. La limitación de las personas de Vitoria no está contemplada. Pueden moverse, viajar y hacer su trabajo y estudios adecuadamente”, ha afirmado Murga.

El Gobierno vasco descarta limitar la movilidad en Vitoria: ""No podemos ni debemos avanzar medidas que no son de este momento de contención""

“Cierran los colegios, pero luego sigue habiendo tres vuelos semanales a Milán”, protesta una vecina de Vitoria justo antes de conocerse que el Gobierno español ha prohibido los vuelos directos a Italia, la zona europea más afectada por el Covid-19, como medida para evitar su expansión. También hay voces en la calle que no entienden que se cierre el campus de la UPV-EHU pero se permita a los universitarios de Vitoria acudir a los campus de Vizcaya o Guipúzcoa, con todo el riesgo que supone para la propagación del virus este movimiento de personas procedentes de uno de los grandes focos de la enfermedad. “Se evita la concentración en este momento del mayor número de personas en Álava y las medidas son en este territorio de contención reforzada”, replica la consejera de Sanidad ante estas críticas.

“De momento, sobrevivimos”. Una sanitaria del hospital de Txagorritxu de Vitoria recurre al humor para combatir al coronavirus con las palabras. La cosa –reconoce– no está para muchas bromas a nivel interno, con el centro de referencia para atender la epidemia convertido en un punto crítico a raíz del contagio de varios profesionales médicos, pero utiliza este tono para proyectar un mensaje de tranquilidad “entre tanta histeria”, sobre todo externa. Su equipo ya ha planificado una excursión a una bodega cuando todo se tranquilice. Pero esta escapada, se tiene asumido, tardará un tiempo en llegar.

- Dentro de la fábrica china que evitó el coronavirus gracias a sus medidas extremas Zigor Aldama. Shanghái

- Lidl pide más suministros por el coronavirus y Mercadona garantiza el abastecimiento José María Olmo Víctor Romero. Valencia

- El Gobierno prohíbe actos cerrados con más de mil personas en zonas de riesgo Juanma Romero","covid, coronavirus, pandemia",30.0,GDELT,estres;estrés,covid;covid-19;coronavirus;cuarentena
Cuida tu salud mental : cómo actuar ante la crisis del coronavirus,20minutos.es,https://www.20minutos.es/noticia/4184903/0/cuida-tu-salud-mental-como-actuar-ante-la-crisis-del-coronavirus/,2020-03-12 11:30:00+00:00,"Cuida tu salud mental: cómo actuar ante la crisis del coronavirus

Basado en hechos observados y verificados directamente por nuestros periodistas o por fuentes informadas.

- A las personas en aislamiento se las recomienda mantener las rutinas diarias personales.

- En momentos de estrés, actividades relajantes, ejercicio, rutinas de sueño y comida saludable.

- Mapa del coronavirus en España // Últimas noticias sobre la evolución del coronavirus

La crisis generada por la epidemia (ya pandemia) de coronavirus está generando mucho estrés en la población. Las pruebas son muchas. Desde la Organización Mundial de la Salud (OMS) se han desarrollado una serie de consideraciones de salud mental para los diferentes sectores de la población como apoyo al bienestar psicológico durante el brote de COVID-19.

Para la sociedad en general, se recomienda no atribuir la enfermedad a ninguna etnia o nacionalidad y ser empático con los afectados. Además se sugiere no hablar de ellos como ‘casos de COVID-19’, ‘víctimas’, ‘familias de COVID-19’ o ‘enfermos’. “Son ‘personas que tienen COVID-19’, ‘personas que están siendo tratadas por COVID-19’ o ‘personas que se están recuperando de COVID-19”, puntualizan desde la OMS.

“El flujo casi constante de noticias sobre un brote puede hacer que cualquiera se sienta preocupado""

Por otro lado, se aconseja no ver, leer o escuchar noticias que causen ansiedad o angustia y buscar información principalmente para tomar medidas de protección. Y no estar constantemente pendiente de la evolución, sino buscar una o dos veces al día las actualizaciones.

“El flujo casi constante de noticias sobre un brote puede hacer que cualquiera se sienta preocupado. Conozca los hechos. Reúna información a intervalos regulares desde las plataformas de las autoridades sanitarias, para distinguir los hechos de los rumores”, explican.

Por último, remarcan la importancia de encontrar el lado positivo de la epidemia, como todas las personas que han experimentado este nuevo coronavirus y lo han superado (casi 66.000 en todo el mundo), y de reconocer el papel del personal sanitario que trabaja para salvar vidas.

Los adultos mayores, especialmente los que están aislados y los que padecen deterioro cognitivo o demencia, pueden sentirse más ansiosos, enojados, estresados, agitados y retraídos durante el brote o mientras están en cuarentena.

“Hay que proporcionar apoyo práctico y emocional a través de familiares y profesionales de la salud y dar información clara sobre la forma de reducir el riesgo de infección con palabras que puedan entender las personas mayores”, apuntan desde la OMS.

Con respecto a las personas en situación de aislamiento, se recomienda mantener las rutinas diarias personales. “Si las autoridades sanitarias han recomendado limitar el contacto social físico para contener el brote, puede mantenerse conectado a través del correo electrónico, los medios sociales, la videoconferencia y el teléfono”.

Los organismos de salud pública y los expertos de todo el mundo están trabajando para garantizar la mejor atención a los afectados, pero es normal sentir intranquilidad. Durante los momentos de estrés, desde la OMS aconsejan realizar actividades relajantes, hacer ejercicio con regularidad, mantener rutinas de sueño regulares y comer alimentos saludables.

“Busque actualizaciones de la información y orientaciones prácticas en momentos concretos del día y evite escuchar o seguir rumores que le hagan sentir incómodo”, concluyen los especialistas.

En una situación como la actual, es normal que el personal sanitario se sienta estresado. “El estrés y los sentimientos asociados no significan que no se pueda hacer el trabajo o se sea débil”, aclaran desde la OMS. “La gestión del estrés y el bienestar psicosocial durante este período es tan importante como la gestión de la salud física”, explican.

Los expertos del Departamento de Salud Mental de la organización insisten a los trabajadores de la salud en la importancia de atender sus necesidades básicas y asegurarse de descansar, comer de forma saludable y realizar actividad física.

Y para evitar el estigma o miedo por parte de su comunidad, se recomienda mantener el contacto con sus seres queridos, incluso a través de métodos digitales. “Este es un escenario único y sin precedentes para muchos trabajadores, particularmente si no han estado involucrados en respuestas similares. Aun así, utilizar las estrategias usadas en el pasado para controlar el estrés puede beneficiarle ahora incluso si el escenario es diferente”.","covid, coronavirus, pandemia",100.0,GDELT,salud mental;ansiedad;estres;estrés,covid;covid-19;coronavirus;pandemia;cuarentena
Saturación y escasez de material en los hospitales madrileños,20minutos.es,https://www.20minutos.es/noticia/4183663/0/saturacion-hospitales-madrilenos-escasez-material/,2020-03-12 06:15:00+00:00,"Saturación y escasez de material en los hospitales madrileños: ""Nos dijeron que había, la realidad es que hay poco""

Basado en hechos observados y verificados directamente por nuestros periodistas o por fuentes informadas.

- ""El material está bajo llave en la urgencia y no tenemos mascarillas"", cuentan trabajadores del Ramón y Cajal.

- ""Nos estamos quedando sin equipos de protección. Nos podemos quedar sin camas de UVI"", asegura el doctor Arribas.

- DIRECTO | Últimas noticias sobre la evolución del coronavirus en el mundo.

Estos días, las inmediaciones del hospital La Paz y del Ramón y Cajal —a menos de un kilómetro— parecen otras. Es como si fuera un día festivo: sin coches, sin apenas gente por la calle. Hay una sensación de calma inusual, como si la vida se hubiera ralentizado en todas partes; en los hospitales no. Allí dentro el ritmo cambia, se vuelve frenético y las mascarillas son 'tendencia'. Hace dos semanas acabó la temporada de gripe (prime time de las urgencias), pero el ajetreo continúa: ha llegado el Covid-19.

""Estamos hasta arriba"", asegura Guillén del Barrio, del sindicato Mats y trabajador de la urgencia de La Paz. ""Las patologías leves que atendíamos antes, de poca relevancia, no están viniendo. La gente está siendo responsable. Pero hay personas que no tienen coronavirus y necesitan atención médica. Si sumamos esos pacientes a los que tienen coronavirus, pues no caben"".

El lunes, por ejemplo, un box de urgencias con capacidad para 30 personas albergó a 62. El martes, a 73. ""Hace 10 años, el Servicio Madrileño de Salud tenía 1.000 camas más, ahora las echamos en falta"", asegura Del Barrio, que pide más celadores y personal de limpieza porque la plantilla de sanitarios sí se ha visto reforzada. ""Han prorrogado los contratos de la gripe"". La Comunidad de Madrid habla de 1.658 contrataciones, 707 prolongaciones del plan de Invierno y 951 específicas por el coronavirus.

Todos ellos ven estos días cómo muchas empresas españolas se vacían mientras los hospitales se llenan. No solo no tienen la opción del teletrabajo, sobretrabajan. ""El hospital está rindiendo más de lo normal. Estamos saturados y hay preocupación, no tanto por contagiarnos nosotros sino a familiares, aunque, de momento, ninguna enfermera de mi equipo ha caído enferma"".

En el Gregorio Marañón la situación es otra. Allí, 50 profesionales permanecieron ayer en casa a la espera de resultados; 10 de ellos dieron positivo. ""Hay inquietud"", explica una trabajadora del centro a 20minutos, ""sobre todo porque los criterios de protección que nos dan varían cada día. Antes había que mantener una distancia de un metro, ahora de metro y medio"".

Esa idea la refuerza un enfermero del hospital Ramón y Cajal. ""Cada día cambian el protocolo. Un día son necesarias unas mascarillas y ahora con las verdes vale, cuando antes decían que no. Además, antes aconsejaban usar dos mascarillas por turno y ahora una. No vemos claridad en los mandos altos. No sé si es falta de previsión o que les está superando"". Para él, sin embargo, el mayor problema es la falta de equipos de protección de los propios profesionales (gorros, gafas, guantes, mascarillas...). ""Nos dijeron que había y la realidad es que hay muy poco"".

Otra trabajadora del centro comparte también esa inquietud. ""El material está bajo llave en la urgencia y no tenemos mascarillas. Si queremos una tenemos que pedírsela al supervisor. Racionalizan el material lo más que pueden"". Fuentes hospitalarias aseguran que las mascarillas se han encarecido un 1.300%, ya que una unidad ha pasado de costar 50 céntimos a 7 euros.

En la UVI del Ramón y Cajal, donde este miércoles había cinco personas con coronavirus además de dos niños, la situación es aún más preocupante, pues el material se deshecha constantemente. «Vamos muy justos equipos de protección, sobre todo en la pediátrica, donde hay desabastecimiento"". Ella resume estos días así: ""Muchísima saturación, mucho estrés, mucha carga de trabajo, no paran de venir pacientes"". Y su compañero recalca: ""Trabajamos a destajo. Ya no estamos en contención, esto ha estallado"".

Este miércoles, Fernando Simón, director del Centro de Coordinación de Alertas y Emergencias sanitarias, respaldó a los sanitarios y reconoció que los hospitales madrileños están ""muy saturados"" y que el personal se encuentra ""bajo un estrés muy importante"", aunque matizó que ""la carga asistencial"" depende mucho de los centros. Por esta razón, la Comunidad valora alternativas como el movimiento de pacientes a otros hospitales. Simón apuntó, además, a que la presión sobre el sistema sanitario madrileño viene dada por las características de sus pacientes, ya que un grupo muy importante son personas mayores, población de riesgo.

El doctor Arribas, jefe de infecciosos de La Paz, se unió en Twitter a las demandas de los enfermeros y alertó: ""Nos estamos quedando sin equipos de protección. Nos podemos quedar sin camas de UVI. La respuesta debe ser prioridad nacional. Por favor, retuit"".","covid, coronavirus, pandemia",30.0,GDELT,estres;estrés,covid;covid-19;coronavirus
